{"argv":["bench","run","-w","cpu_int","-n","12","--warmup","5","--spin-ms","500","--trial-ms","50","-o","/tmp/claude-1000/-home-matthewlee-benchmark-platform/1b4963e7-e04f-4fcf-a220-1bbd725c7ae7/scratchpad/ab_warm3.json"],"finished_at":"2026-09-18T22:15:29.942846Z","machine":{"compiler":"g++ 13.4.0","compiler_flags":"-O3 -DNDEBUG -march=native -fno-omit-frame-pointer","cpu_model":"Intel(R) Core(TM) Ultra 9 185H","engine_git_sha":"6df8b06","engine_version":"0.1.0","hostname":"MatthewLaptop","id":"db75f1b3c89e468350d296c32d605afa","kernel":"6.18.33.2-microsoft-standard-WSL2","l1d_kb":48,"l2_kb":2048,"l3_kb":24576,"logical_cpus":22,"memory_bytes":16561385472,"os":"Ubuntu 22.04.5 LTS","physical_cores":11,"virtualized":"wsl2"},"results":[{"duration_ns":50072374,"metric":"cpu_int_ops","params":{"batch_ops":1048576,"batches":99,"clock_call_ns":39.35064,"clock_res_ns":1,"cold":"none","ops":103809024,"pinned":false,"seed":0,"spin_ms":500,"trial_ms":50,"warmup_trials":5},"thread_count":1,"timestamp":"2026-09-18T22:15:29.388077Z","trial":0,"unit":"ops/s","value":2073179594.0012748,"working_set_bytes":0,"workload":"cpu_int"},{"duration_ns":50306132,"metric":"cpu_int_ops","params":{"batch_ops":1048576,"batches":61,"clock_call_ns":39.35064,"clock_res_ns":1,"cold":"none","ops":63963136,"pinned":false,"seed":0,"spin_ms":500,"trial_ms":50,"warmup_trials":5},"thread_count":1,"timestamp":"2026-09-18T22:15:29.438443Z","trial":1,"unit":"ops/s","value":1271477918.437458,"working_set_bytes":0,"workload":"cpu_int"},{"duration_ns":50360847,"metric":"cpu_int_ops","params":{"batch_ops":1048576,"batches":67,"clock_call_ns":39.35064,"clock_res_ns":1,"cold":"none","ops":70254592,"pinned":false,"seed":0,"spin_ms":500,"trial_ms":50,"warmup_trials":5},"thread_count":1,"timestamp":"2026-09-18T22:15:29.488878Z","trial":2,"unit":"ops/s","value":1395024035.2391214,"working_set_bytes":0,"workload":"cpu_int"},{"duration_ns":50640043,"metric":"cpu_int_ops","params":{"batch_ops":1048576,"batches":68,"clock_call_ns":39.35064,"clock_res_ns":1,"cold":"none","ops":71303168,"pinned":false,"seed":0,"spin_ms":500,"trial_ms":50,"warmup_trials":5},"thread_count":1,"timestamp":"2026-09-18T22:15:29.539596Z","trial":3,"unit":"ops/s","value":1408039246.7281277,"working_set_bytes":0,"workload":"cpu_int"},{"duration_ns":50505727,"metric":"cpu_int_ops","params":{"batch_ops":1048576,"batches":81,"clock_call_ns":39.35064,"clock_res_ns":1,"cold":"none","ops":84934656,"pinned":false,"seed":0,"spin_ms":500,"trial_ms":50,"warmup_trials":5},"thread_count":1,"timestamp":"2026-09-18T22:15:29.590296Z","trial":4,"unit":"ops/s","value":1681683663.3200033,"working_set_bytes":0,"workload":"cpu_int"},{"duration_ns":50412293,"metric":"cpu_int_ops","params":{"batch_ops":1048576,"batches":86,"clock_call_ns":39.35064,"clock_res_ns":1,"cold":"none","ops":90177536,"pinned":false,"seed":0,"spin_ms":500,"trial_ms":50,"warmup_trials":5},"thread_count":1,"timestamp":"2026-09-18T22:15:29.640828Z","trial":5,"unit":"ops/s","value":1788800521.33316,"working_set_bytes":0,"workload":"cpu_int"},{"duration_ns":50403848,"metric":"cpu_int_ops","params":{"batch_ops":1048576,"batches":102,"clock_call_ns":39.35064,"clock_res_ns":1,"cold":"none","ops":106954752,"pinned":false,"seed":0,"spin_ms":500,"trial_ms":50,"warmup_trials":5},"thread_count":1,"timestamp":"2026-09-18T22:15:29.691289Z","trial":6,"unit":"ops/s","value":2121956085.5750537,"working_set_bytes":0,"workload":"cpu_int"},{"duration_ns":50210833,"metric":"cpu_int_ops","params":{"batch_ops":1048576,"batches":100,"clock_call_ns":39.35064,"clock_res_ns":1,"cold":"none","ops":104857600,"pinned":false,"seed":0,"spin_ms":500,"trial_ms":50,"warmup_trials":5},"thread_count":1,"timestamp":"2026-09-18T22:15:29.741558Z","trial":7,"unit":"ops/s","value":2088346154.3049881,"working_set_bytes":0,"workload":"cpu_int"},{"duration_ns":50160034,"metric":"cpu_int_ops","params":{"batch_ops":1048576,"batches":100,"clock_call_ns":39.35064,"clock_res_ns":1,"cold":"none","ops":104857600,"pinned":false,"seed":0,"spin_ms":500,"trial_ms":50,"warmup_trials":5},"thread_count":1,"timestamp":"2026-09-18T22:15:29.791779Z","trial":8,"unit":"ops/s","value":2090461102.9569876,"working_set_bytes":0,"workload":"cpu_int"},{"duration_ns":50317962,"metric":"cpu_int_ops","params":{"batch_ops":1048576,"batches":102,"clock_call_ns":39.35064,"clock_res_ns":1,"cold":"none","ops":106954752,"pinned":false,"seed":0,"spin_ms":500,"trial_ms":50,"warmup_trials":5},"thread_count":1,"timestamp":"2026-09-18T22:15:29.842181Z","trial":9,"unit":"ops/s","value":2125577979.4897099,"working_set_bytes":0,"workload":"cpu_int"},{"duration_ns":50441488,"metric":"cpu_int_ops","params":{"batch_ops":1048576,"batches":102,"clock_call_ns":39.35064,"clock_res_ns":1,"cold":"none","ops":106954752,"pinned":false,"seed":0,"spin_ms":500,"trial_ms":50,"warmup_trials":5},"thread_count":1,"timestamp":"2026-09-18T22:15:29.892678Z","trial":10,"unit":"ops/s","value":2120372658.3165033,"working_set_bytes":0,"workload":"cpu_int"},{"duration_ns":50078035,"metric":"cpu_int_ops","params":{"batch_ops":1048576,"batches":99,"clock_call_ns":39.35064,"clock_res_ns":1,"cold":"none","ops":103809024,"pinned":false,"seed":0,"spin_ms":500,"trial_ms":50,"warmup_trials":5},"thread_count":1,"timestamp":"2026-09-18T22:15:29.942801Z","trial":11,"unit":"ops/s","value":2072945234.3727145,"working_set_bytes":0,"workload":"cpu_int"}],"run_id":"8c09c93d-5212-4899-8e72-1f9d5a357a01","schema_version":1,"started_at":"2026-09-18T22:15:28.582508Z","summary":[]}
