{"argv":["bench","run","-w","cpu_int","-t","8","-n","10","--trial-ms","20","--pin","-v","-o","../docs/results/m2.1/pin_8t.json"],"finished_at":"2026-09-18T22:52:22.775633Z","machine":{"compiler":"g++ 13.4.0","compiler_flags":"-O3 -DNDEBUG -march=native -fno-omit-frame-pointer","cpu_model":"Intel(R) Core(TM) Ultra 9 185H","engine_git_sha":"5c9f897","engine_version":"0.1.0","hostname":"MatthewLaptop","id":"db75f1b3c89e468350d296c32d605afa","kernel":"6.18.33.2-microsoft-standard-WSL2","l1d_kb":48,"l2_kb":2048,"l3_kb":24576,"logical_cpus":22,"memory_bytes":16561385472,"os":"Ubuntu 22.04.5 LTS","physical_cores":11,"virtualized":"wsl2"},"results":[{"duration_ns":20304241,"metric":"cpu_int_ops","params":{"batch_ops":1048576,"clock_call_ns":15.82634,"clock_res_ns":1,"cold":"none","cpus":[0,2,4,6,8,10,12,14],"ops":552599552,"per_thread_cpu":[0,2,4,6,8,10,12,14],"per_thread_ops_per_s":[2957522184.323985,1932779065.5561383,3718422737.059603,3108935612.3887467,4150466153.9124537,3799184634.5199184,3827215139.4948196,3887482716.1365294],"per_thread_start_us":[0.225,0.39,0.217,0.16,74.947,0.234,0.267,7.291],"pin_failures":0,"pin_violations":0,"pinned":true,"release_to_first_start_us":0.16,"seed":0,"spin_ms":500,"start_spread_us":74.787,"trial_ms":20,"warmup_ms":500,"warmup_trials":5,"warmups_run":12},"thread_count":8,"timestamp":"2026-09-18T22:52:22.584620Z","trial":0,"unit":"ops/s","value":27215966949.958878,"working_set_bytes":0,"workload":"cpu_int"},{"duration_ns":23255888,"metric":"cpu_int_ops","params":{"batch_ops":1048576,"clock_call_ns":15.82634,"clock_res_ns":1,"cold":"none","cpus":[0,2,4,6,8,10,12,14],"ops":549453824,"per_thread_cpu":[0,2,4,6,8,10,12,14],"per_thread_ops_per_s":[4031163946.832804,2055476393.9226606,3920385514.1468115,1578187972.0325668,3734591356.3091917,3636714964.739378,3910028845.730282,4132895863.801512],"per_thread_start_us":[62.103,0.489,7.598,0.292,0.227,0.2,0.278,0.332],"pin_failures":0,"pin_violations":0,"pinned":true,"release_to_first_start_us":0.2,"seed":0,"spin_ms":500,"start_spread_us":61.903,"trial_ms":20,"warmup_ms":500,"warmup_trials":5,"warmups_run":12},"thread_count":8,"timestamp":"2026-09-18T22:52:22.608028Z","trial":1,"unit":"ops/s","value":23626439205.417572,"working_set_bytes":0,"workload":"cpu_int"},{"duration_ns":20407253,"metric":"cpu_int_ops","params":{"batch_ops":1048576,"clock_call_ns":15.82634,"clock_res_ns":1,"cold":"none","cpus":[0,2,4,6,8,10,12,14],"ops":543162368,"per_thread_cpu":[0,2,4,6,8,10,12,14],"per_thread_ops_per_s":[3228995085.808496,2194252478.6375203,3724793931.826292,2364065244.6675034,3700971025.913445,3818525900.071276,3821123070.8260136,4100025623.4575253],"per_thread_start_us":[0.835,0.353,0.322,3.449,1.343,11.156,0.551,0.435],"pin_failures":0,"pin_violations":0,"pinned":true,"release_to_first_start_us":0.322,"seed":0,"spin_ms":500,"start_spread_us":10.834,"trial_ms":20,"warmup_ms":500,"warmup_trials":5,"warmups_run":12},"thread_count":8,"timestamp":"2026-09-18T22:52:22.628786Z","trial":2,"unit":"ops/s","value":26616143191.834785,"working_set_bytes":0,"workload":"cpu_int"},{"duration_ns":20328181,"metric":"cpu_int_ops","params":{"batch_ops":1048576,"clock_call_ns":15.82634,"clock_res_ns":1,"cold":"none","cpus":[0,2,4,6,8,10,12,14],"ops":570425344,"per_thread_cpu":[0,2,4,6,8,10,12,14],"per_thread_ops_per_s":[4011349575.767103,2378274840.029947,3815987044.416544,2372858212.9718947,4112498594.415442,3847750811.517612,3819060295.0242934,3960829565.808022],"per_thread_start_us":[94.682,0.326,0.385,0.321,0.331,7.609,0.214,0.423],"pin_failures":0,"pin_violations":0,"pinned":true,"release_to_first_start_us":0.214,"seed":0,"spin_ms":500,"start_spread_us":94.468,"trial_ms":20,"warmup_ms":500,"warmup_trials":5,"warmups_run":12},"thread_count":8,"timestamp":"2026-09-18T22:52:22.649209Z","trial":3,"unit":"ops/s","value":28060815869.358894,"working_set_bytes":0,"workload":"cpu_int"},{"duration_ns":20336707,"metric":"cpu_int_ops","params":{"batch_ops":1048576,"clock_call_ns":15.82634,"clock_res_ns":1,"cold":"none","cpus":[0,2,4,6,8,10,12,14],"ops":573571072,"per_thread_cpu":[0,2,4,6,8,10,12,14],"per_thread_ops_per_s":[4180522072.8823285,3902835847.71639,3837906842.6013827,2406717383.811242,3930664971.57806,2371921117.3456,3662823862.2053666,4220745249.4247665],"per_thread_start_us":[0.404,11.358,0.3,1.805,0.834,0.319,0.431,0.694],"pin_failures":0,"pin_violations":0,"pinned":true,"release_to_first_start_us":0.3,"seed":0,"spin_ms":500,"start_spread_us":11.058,"trial_ms":20,"warmup_ms":500,"warmup_trials":5,"warmups_run":12},"thread_count":8,"timestamp":"2026-09-18T22:52:22.670467Z","trial":4,"unit":"ops/s","value":28203733869.008392,"working_set_bytes":0,"workload":"cpu_int"},{"duration_ns":20463030,"metric":"cpu_int_ops","params":{"batch_ops":1048576,"clock_call_ns":15.82634,"clock_res_ns":1,"cold":"none","cpus":[0,2,4,6,8,10,12,14],"ops":569376768,"per_thread_cpu":[0,2,4,6,8,10,12,14],"per_thread_ops_per_s":[2439142993.614922,3937092503.456798,3809706508.548965,2334631204.9772167,4062500645.7170877,3997635493.5803175,3614653547.181108,4070163390.413408],"per_thread_start_us":[0.402,0.211,0.194,0.229,100.631,265.548,7.553,0.126],"pin_failures":0,"pin_violations":0,"pinned":true,"release_to_first_start_us":0.126,"seed":0,"spin_ms":500,"start_spread_us":265.422,"trial_ms":20,"warmup_ms":500,"warmup_trials":5,"warmups_run":12},"thread_count":8,"timestamp":"2026-09-18T22:52:22.691030Z","trial":5,"unit":"ops/s","value":27824655879.407887,"working_set_bytes":0,"workload":"cpu_int"},{"duration_ns":20180189,"metric":"cpu_int_ops","params":{"batch_ops":1048576,"clock_call_ns":15.82634,"clock_res_ns":1,"cold":"none","cpus":[0,2,4,6,8,10,12,14],"ops":572522496,"per_thread_cpu":[0,2,4,6,8,10,12,14],"per_thread_ops_per_s":[2251324480.5447345,3962480930.146434,3704530984.7436247,2390429657.3970785,3971411656.1249776,4210919352.003148,3876626990.937007,4129763018.044378],"per_thread_start_us":[0.683,0.397,32.575,0.772,0.958,0.357,0.277,0.603],"pin_failures":0,"pin_violations":0,"pinned":true,"release_to_first_start_us":0.277,"seed":0,"spin_ms":500,"start_spread_us":32.298,"trial_ms":20,"warmup_ms":500,"warmup_trials":5,"warmups_run":12},"thread_count":8,"timestamp":"2026-09-18T22:52:22.712330Z","trial":6,"unit":"ops/s","value":28370522000.562035,"working_set_bytes":0,"workload":"cpu_int"},{"duration_ns":20335334,"metric":"cpu_int_ops","params":{"batch_ops":1048576,"clock_call_ns":15.82634,"clock_res_ns":1,"cold":"none","cpus":[0,2,4,6,8,10,12,14],"ops":549453824,"per_thread_cpu":[0,2,4,6,8,10,12,14],"per_thread_ops_per_s":[2379847457.264183,3096399568.1202335,3815904661.47507,2601535005.2907686,3319783578.700213,4121890420.391254,3797720059.595779,4061244307.281377],"per_thread_start_us":[0.403,0.296,0.139,0.49,0.717,0.757,10.716,0.532],"pin_failures":0,"pin_violations":0,"pinned":true,"release_to_first_start_us":0.139,"seed":0,"spin_ms":500,"start_spread_us":10.577,"trial_ms":20,"warmup_ms":500,"warmup_trials":5,"warmups_run":12},"thread_count":8,"timestamp":"2026-09-18T22:52:22.733703Z","trial":7,"unit":"ops/s","value":27019660655.684338,"working_set_bytes":0,"workload":"cpu_int"},{"duration_ns":20244764,"metric":"cpu_int_ops","params":{"batch_ops":1048576,"clock_call_ns":15.82634,"clock_res_ns":1,"cold":"none","cpus":[0,2,4,6,8,10,12,14],"ops":544210944,"per_thread_cpu":[0,2,4,6,8,10,12,14],"per_thread_ops_per_s":[2595242197.8714767,3751378901.5087957,3699934766.8718286,2285696733.9952264,3056122689.9261246,4054870318.054434,3680780572.3889008,3867439124.857509],"per_thread_start_us":[0.379,0.22,0.223,24.855,0.31,0.284,0.254,8.28],"pin_failures":0,"pin_violations":0,"pinned":true,"release_to_first_start_us":0.22,"seed":0,"spin_ms":500,"start_spread_us":24.635,"trial_ms":20,"warmup_ms":500,"warmup_trials":5,"warmups_run":12},"thread_count":8,"timestamp":"2026-09-18T22:52:22.754130Z","trial":8,"unit":"ops/s","value":26881565228.421535,"working_set_bytes":0,"workload":"cpu_int"},{"duration_ns":20380515,"metric":"cpu_int_ops","params":{"batch_ops":1048576,"clock_call_ns":15.82634,"clock_res_ns":1,"cold":"none","cpus":[0,2,4,6,8,10,12,14],"ops":541065216,"per_thread_cpu":[0,2,4,6,8,10,12,14],"per_thread_ops_per_s":[2782983837.019078,3680520542.5775805,3503553617.8970466,2483247533.4359097,3157167296.9832664,3783279030.2206435,3441983938.2740808,3953160776.510663],"per_thread_start_us":[0.271,8.031,0.27,0.373,120.088,0.313,0.375,0.578],"pin_failures":0,"pin_violations":0,"pinned":true,"release_to_first_start_us":0.27,"seed":0,"spin_ms":500,"start_spread_us":119.818,"trial_ms":20,"warmup_ms":500,"warmup_trials":5,"warmups_run":12},"thread_count":8,"timestamp":"2026-09-18T22:52:22.774698Z","trial":9,"unit":"ops/s","value":26548162104.833958,"working_set_bytes":0,"workload":"cpu_int"}],"run_id":"83921411-b445-489e-a57e-6cbccdc91ef1","schema_version":1,"started_at":"2026-09-18T22:52:21.500951Z","summary":[]}
